<?xml version="1.0" encoding="utf-8" ?>
<report xmlns:xsi="http://www.w3.org/2001/XMLSchema-instance" xsi:noNamespaceSchemaLocation="XMLReport.xsd">
  <pagina formato="A4" orientamento="ORIZZONTALE">
    <dta_stampa align="RIGHT" target="footer" font="Arial" size="10" style="PLAIN" color="#000000">Stampa effettuata il: </dta_stampa>
    <num_pagine align="CENTER" target="footer" font="Arial" size="8" style="PLAIN" color="#000000" total="1" separator="/" widthTot="5">Pag. </num_pagine>
  </pagina>
  <header align="LEFT" font="Arial" size="16" style="BOLD" color="#000000" bgcolor="#FFFFFF" border="1">Stampa Dettaglio Pratica</header>
  <logo align="LEFT" file="" bgcolor="#FFFFFF"/>
  <dati>
    <paragrafo align="LEFT" font="Arial" size="10" style="BOLD" color="#000000" bgcolor="#FFFFFF" target="PAR_ANNO">Anno: @param1</paragrafo>
    <paragrafo align="LEFT" font="Arial" size="10" style="BOLD" color="#000000" bgcolor="#FFFFFF" target="PAR_CLASSIFICA">Classifica: @param2</paragrafo>
    <paragrafo align="LEFT" font="Arial" size="10" style="BOLD" color="#000000" bgcolor="#FFFFFF" target="PAR_PRATICA">Pratica: @param3</paragrafo>
    <paragrafo align="LEFT" font="Arial" size="10" style="BOLD" color="#000000" bgcolor="#FFFFFF" target="PAR_REGISTRO">Registro: @param5 - @param4</paragrafo>
  </dati>
  <dati>
    <tabella showBorder="true" target="TABLE_ANNO" padding="2" spacing="0">
      <header_tabella align="CENTER" font="Arial" size="10" style="BOLD" color="#000000" bgcolor="#C0C0C0" valign="middle"/>
      <dati_tabella align="LEFT" font="Arial" size="8" style="PLAIN" color="#000000" bgcolor="#C0C0C0" valign="bottom"/>
      <colonne>
        <colonna name="NUM_FASCICOLO" alias="Numero Atto" visible="true" width="20" align="center" valign="top"/>
        <colonna name="DESCRIZIONE" alias="Descrizione" visible="true" width="40" align="left" valign="top"/>
        <colonna name="DTA_CREAZIONE" alias="Data" visible="true" width="20" align="center" valign="top"/>        
      </colonne>
    </tabella>
  </dati>
  <footer align="LEFT" font="Arial" size="8" style="PLAIN" color="#000000" bgcolor="#FFFFFF" border="1">

  </footer>
</report>