<?xml version="1.0" encoding="utf-8"?>
<report xmlns:xsi="http://www.w3.org/2001/XMLSchema-instance" xsi:noNamespaceSchemaLocation="XMLReport.xsd">
	<pagina formato="A4" orientamento="ORIZZONTALE">
		<dta_stampa align="RIGHT" target="footer" font="Arial" size="10" style="PLAIN" color="#000000">Stampa effettuata il: </dta_stampa>
		<num_pagine align="CENTER" target="footer" font="Arial" size="8" style="PLAIN" color="#000000" total="1" separator="/" widthTot="5">Pag. </num_pagine>
	</pagina>
	<header align="LEFT" font="Arial" size="16" style="BOLD" color="#000000" bgcolor="#FFFFFF" border="1">Rapporto annuale sui documenti spediti</header>
	<logo align="LEFT" file="" bgcolor="#FFFFFF"/>
	<dati>
		<paragrafo align="LEFT" font="Arial" size="10" style="BOLD" color="#000000" bgcolor="#FFFFFF" target="PAR_REGISTRO">@param4 - Registro: @param1 - Anno: @param2</paragrafo>
		<paragrafo align="LEFT" font="Arial" size="10" style="BOLD" color="#000000" bgcolor="#FFFFFF" target="TOT_SPED">Totale documenti spediti: @param3</paragrafo>
    <paragrafo align="LEFT" font="Arial" size="10" style="PLAIN" color="#000000" bgcolor="#FFFFFF" target="SPED_INTEROP">Documenti spediti tramite Interoperabilità: @param5</paragrafo>
    <paragrafo align="LEFT" font="Arial" size="10" style="PLAIN" color="#000000" bgcolor="#FFFFFF" target="SPED_IS">Documenti spediti tramite Interoperabilità PITRE: @param7</paragrafo>
    <paragrafo align="LEFT" font="Arial" size="10" style="PLAIN" color="#000000" bgcolor="#FFFFFF" target="SPED_MAIL">Documenti spediti tramite Mail: @param6</paragrafo>
	</dati>
  <dati>
    <paragrafo align="LEFT" font="Arial" size="10" style="BOLD" color="#000000" bgcolor="#FFFFFF" target="TOT_SPED_AMM">Documenti spediti ad altre amministrazioni: @param8</paragrafo>
  </dati>
	<dati>
		<tabella showBorder="true" target="TABLE_AMM" padding="2" spacing="0">
			<header_tabella align="CENTER" font="Arial" size="10" style="BOLD" color="#000000" bgcolor="#C0C0C0" valign="middle"/>
			<dati_tabella align="LEFT" font="Arial" size="8" style="PLAIN" color="#000000" bgcolor="#C0C0C0" valign="bottom"/>
			<colonne>
				<colonna name="VAR_COD_AMM" alias="Cod. AOO" visible="true" width="80" align="left" valign="top"/>
				<colonna name="CANALE_SPED" alias="Canale Sped." visible="true" width="70" align="left" valign="top"/>
				<colonna name="GENNAIO" alias="Gen" visible="true" width="" align="center" valign="top"/>
				<colonna name="FEBBRAIO" alias="Feb" visible="true" width="" align="center" valign="top"/>
				<colonna name="MARZO" alias="Mar" visible="true" width="" align="center" valign="top"/>
				<colonna name="APRILE" alias="Apr" visible="true" width="" align="center" valign="top"/>
				<colonna name="MAGGIO" alias="Mag" visible="true" width="" align="center" valign="top"/>
				<colonna name="GIUGNO" alias="Giu" visible="true" width="" align="center" valign="top"/>
				<colonna name="LUGLIO" alias="Lug" visible="true" width="" align="center" valign="top"/>
				<colonna name="AGOSTO" alias="Ago" visible="true" width="" align="center" valign="top"/>
				<colonna name="SETTEMBRE" alias="Set" visible="true" width="" align="center" valign="top"/>
				<colonna name="OTTOBRE" alias="Ott" visible="true" width="" align="center" valign="top"/>
				<colonna name="NOVEMBRE" alias="Nov" visible="true" width="" align="center" valign="top"/>
				<colonna name="DICEMBRE" alias="Dic" visible="true" width="" align="center" valign="top"/>
				<colonna name="TOT_M_SPED" alias="Totale" visible="true" width="" align="center" valign="top"/>
			</colonne>
		</tabella>
	</dati>
  <dati>
    <paragrafo align="LEFT" font="Arial" size="10" style="BOLD" color="#000000" bgcolor="#FFFFFF" target="TOT_SPED_PR">Documenti spediti a persone/ruoli: @param9</paragrafo>
  </dati>
  <dati>
    <tabella showBorder="true" target="TABLE_PR" padding="2" spacing="0">
      <header_tabella align="CENTER" font="Arial" size="10" style="BOLD" color="#000000" bgcolor="#C0C0C0" valign="middle"/>
      <dati_tabella align="LEFT" font="Arial" size="8" style="PLAIN" color="#000000" bgcolor="#C0C0C0" valign="bottom"/>
      <colonne>
        <colonna name="VAR_COD_AMM" alias="Cod. AOO" visible="true" width="80" align="left" valign="top"/>
        <colonna name="CANALE_SPED" alias="Canale Sped." visible="true" width="70" align="left" valign="top"/>
        <colonna name="GENNAIO" alias="Gen" visible="true" width="" align="center" valign="top"/>
        <colonna name="FEBBRAIO" alias="Feb" visible="true" width="" align="center" valign="top"/>
        <colonna name="MARZO" alias="Mar" visible="true" width="" align="center" valign="top"/>
        <colonna name="APRILE" alias="Apr" visible="true" width="" align="center" valign="top"/>
        <colonna name="MAGGIO" alias="Mag" visible="true" width="" align="center" valign="top"/>
        <colonna name="GIUGNO" alias="Giu" visible="true" width="" align="center" valign="top"/>
        <colonna name="LUGLIO" alias="Lug" visible="true" width="" align="center" valign="top"/>
        <colonna name="AGOSTO" alias="Ago" visible="true" width="" align="center" valign="top"/>
        <colonna name="SETTEMBRE" alias="Set" visible="true" width="" align="center" valign="top"/>
        <colonna name="OTTOBRE" alias="Ott" visible="true" width="" align="center" valign="top"/>
        <colonna name="NOVEMBRE" alias="Nov" visible="true" width="" align="center" valign="top"/>
        <colonna name="DICEMBRE" alias="Dic" visible="true" width="" align="center" valign="top"/>
        <colonna name="TOT_M_SPED" alias="Totale" visible="true" width="" align="center" valign="top"/>
      </colonne>
    </tabella>
  </dati>
	<footer align="LEFT" font="Arial" size="8" style="PLAIN" color="#000000" bgcolor="#FFFFFF" border="1">

	</footer>
</report>
