<?xml version="1.0"?>
<report xmlns:xsi="http://www.w3.org/2001/XMLSchema-instance" xsi:noNamespaceSchemaLocation="XMLReport.xsd">
	<pagina formato="A4" orientamento="ORIZZONTALE">
		<dta_stampa align="RIGHT" target="footer" font="Arial" size="10" style="PLAIN" color="#000000">Stampa effettuata il: </dta_stampa>
		<num_pagine align="CENTER" target="footer" font="Arial" size="8" style="PLAIN" color="#000000" total="1" separator="/" widthTot="5">Pag. </num_pagine>
	</pagina>
	<!--<header align="RIGHT" font="Arial" size="8" style="PLAIN" color="#000000" bgcolor="#FFFFFF" border="0"></header>-->
	<!--<logo align="LEFT" file="" bgcolor="#FFFFFF"/>-->
  <header/>
  <logo/>
  <dati>
		<paragrafo align="LEFT" font="Arial" size="14" style="BOLD" color="#000000" bgcolor="#FFFFFF" target="PAR_AMMINISTRA">@paramAmm</paragrafo>
		<paragrafo align="LEFT" font="Arial" size="14" style="BOLD" color="#000000" bgcolor="#FFFFFF" target="PAR_REGISTRO">Registro: @param0</paragrafo>
		<paragrafo align="LEFT" font="Arial" size="12" style="PLAIN" color="#000000" bgcolor="#FFFFFF" target="PAR_RANGE_PROTOCOLLO">Stampa del Registro Ufficiale di Protocollo dal numero @param1 al numero @param2</paragrafo>
	</dati>
	<dati>
		<tabella showBorder="true" target="TABLE_PROTOCOLLO" padding="2" spacing="0">
			<header_tabella align="CENTER" font="Arial" size="8" style="BOLD" color="#000000" bgcolor="#C0C0C0" valign="middle"/>
			<dati_tabella align="LEFT" font="Arial" size="7" style="PLAIN" color="#000000" bgcolor="#C0C0C0" valign="bottom"/>
			<colonne>
				<colonna name="NUM_PROTO" alias="Protocollo" visible="true" width="40" align="center" valign="top" />
				<colonna name="DATA" alias="Data" visible="true" width="35" align="center" valign="top"/>
				<colonna name="DATA_ANNULLAMENTO" alias="ANNULLATO IL" visible="true" width="50" align="center" valign="top"/>
				<colonna name="CHA_TIPO_PROTO" alias="Tipo" visible="true" width="20" align="center" valign="top"/>
				<colonna name="OGGETTO" alias="Oggetto" visible="true" width="170" align="left" valign="top"/>
				<colonna name="MITT_DEST" alias="Mitt./Dest." visible="true" width="150" align="left" valign="top"/>
				<colonna name="FASCICOLI" alias="Fascicoli" visible="true" width="50" align="center" valign="top"/>
				<colonna name="IMPRONTA" alias="Impronta" visible="true" width="80" align="left" valign="top"/>
				<colonna name="N_ALLEGATI" alias="All.ti" visible="true" width="20" align="center" valign="top"/>
			</colonne>
		</tabella>
	</dati>
	<dati>
		<paragrafo align="LEFT" font="Arial" size="12" style="PLAIN" color="#000000" bgcolor="#FFFFFF" target="PAR_RANGE_VARIAZIONI">Modifiche apportate ai documenti protocollati prima del @param0</paragrafo>
	</dati>
	<dati>
		<tabella showBorder="true" target="TABLE_VARIAZIONI" padding="2" spacing="0">
			<header_tabella align="CENTER" font="Arial" size="8" style="BOLD" color="#000000" bgcolor="#C0C0C0" valign="middle"/>
			<dati_tabella align="LEFT" font="Arial" size="7" style="PLAIN" color="#000000" bgcolor="#C0C0C0" valign="bottom"/>
			<colonne>
				<colonna name="NUM_PROTO" alias="Protocollo" visible="true" width="40" align="center" valign="top"/>
				<colonna name="DATA" alias="Data" visible="true" width="35" align="center" valign="top"/>
				<colonna name="DATA_ANNULLAMENTO" alias="ANNULLATO IL" visible="true" width="50" align="center" valign="top"/>
				<colonna name="CHA_TIPO_PROTO" alias="Tipo" visible="true" width="20" align="center" valign="top"/>
				<colonna name="OGGETTO" alias="Oggetto" visible="true" width="170" align="left" valign="top"/>
				<colonna name="MITT_DEST" alias="Mitt./Dest." visible="true" width="150" align="left" valign="top"/>
				<colonna name="FASCICOLI" alias="Fascicoli" visible="true" width="50" align="center" valign="top"/>
				<colonna name="IMPRONTA" alias="Impronta" visible="true" width="80" align="left" valign="top"/>
				<colonna name="N_ALLEGATI" alias="All.ti" visible="true" width="20" align="center" valign="top"/>
			</colonne>
		</tabella>
	</dati>
  <footer align="LEFT" font="Arial" size="8" style="PLAIN" color="#000000" bgcolor="#FFFFFF" border="0">IL RESPONSABILE DEL SERVIZIO _____________________________________</footer>
</report>
